{
  "$schema": "shared/schemas/directive-engine-run-record.schema.json",
  "schemaVersion": 2,
  "recordKind": "directive_engine_run_record",
  "runId": "0b4bbce1-8306-4104-b993-07c69622feff",
  "receivedAt": "2026-04-06T15:45:00.000Z",
  "source": {
    "sourceId": "research-engine-open-deep-research-20260406t145339z-20260406t154500z",
    "sourceType": "external-system",
    "sourceRef": "https://github.com/langchain-ai/open_deep_research",
    "title": "Open Deep Research",
    "summary": "Breaks deep research into typed phases instead of collapsing everything into an answer loop. Imported from research-engine for Directive Workspace Discovery review only.",
    "notes": [
      "Imported source candidate open-deep-research from research-engine bundle C:/Users/User/projects/directive-workspace/discovery/research-engine/artifacts-live-test/dw_import_bundle.json. Bundle decision boundary: This bundle is import-ready for Directive Workspace Discovery review only; it must not be treated as a routing or adoption decision. Source intelligence boundary: Research Engine gathers source intelligence and scoring signals only; it does not decide what Directive Workspace Discovery should adopt or route. Discovery packet boundary: Research Engine prepares Discovery-facing candidate packets; Directive Workspace Discovery retains final route and adoption authority. Research-engine source kind: framework Discovery signal band: weak Signal score summary: Weak or noisy Discovery review signal due to baseline overlap, limited evidence quality, low relevance, or both. Score summary: total=81; relevance=8/10; evidence_quality=9/10; inspectability=9/10; subsystem_reuse=8/10; novelty=1/10. Signal total score: 81. Initial value hypothesis: Best conceptual base for Research Engine because its orchestration boundaries map cleanly to planning, discovery, compression, and reporting. Baggage signals: LangGraph-flavored orchestration assumptions | Report-centric end shape. Capability gap hint: Need reusable phase boundaries and provider seams for bounded research runs. Freshness: Latest normalized evidence captured at 2026-04-06T14:53:39+00:00. Freshest observed source update at 2026-03-29T00:00:00+00:00 (8 days old at capture; 5/5 evidence items carried source dates; signal=current). Evidence bundle refs: open-deep-research-e1, open-deep-research-e2, open-deep-research-e3, open-deep-research-e4, open-deep-research-e5. Evidence cluster summary: Collapsed 5 evidence items into 5 clusters. | No duplicate evidence clusters detected. | No contradiction flags detected across clustered evidence.. Provenance: primary via catalog:official-docs (github-repo). Uncertainty notes: Current run is catalog-backed and should later be upgraded to live-provider evidence.",
      "record_shape:queue_only"
    ],
    "missionAlignmentHint": "Breaks deep research into typed phases instead of collapsing everything into an answer loop. Imported from research-engine for Directive Workspace Discovery review only.",
    "capabilityGapId": null,
    "primaryAdoptionTarget": "architecture",
    "containsExecutableCode": true,
    "containsWorkflowPattern": true,
    "improvesDirectiveWorkspace": true,
    "workflowBoundaryShape": "bounded_protocol"
  },
  "mission": {
    "missionId": "directive-workspace-discovery-front-door",
    "currentObjective": "Build and operate a revenue-generating personal AI workspace that continuously strengthens its own capabilities through mission-driven ingestion, proof-backed adoption, and persistent orchestration.",
    "usefulnessSignals": [
      "Useful means anything that materially improves:",
      "revenue and conversion",
      "execution speed and automation strength",
      "decision quality and strategic leverage",
      "cost efficiency and reliability",
      "orchestration quality and agent coordination",
      "capability-gap detection and self-improvement velocity"
    ],
    "capabilityLanes": [
      "Directive engine materialization - one reusable executable core that hosts can embed cleanly",
      "Runtime operationalization (Runtime) - converting proven patterns into callable, bounded, measurable runtime behavior",
      "Orchestration reliability (OpenClaw) - persistent, looping, memory-backed coordination across agents and sessions",
      "Discovery as operational front door - mission-aware intake, routing, capability-gap detection, and review-cadence enforcement",
      "Behavior-preserving transformation - same capability, better implementation (speed, cost, reliability, maintainability)",
      "Evaluation quality - dimensional measurement (evaluators), not just binary gates",
      "Unified runtime host (Mission Control) - coherent command surface, less fragmented tooling"
    ],
    "activeMissionMarkdown": "# Active Mission\n\nLast updated: 2026-03-24\nStatus: canonical\n\n## Current Objective\n\nBuild and operate a revenue-generating personal AI workspace that continuously strengthens its own capabilities through mission-driven ingestion, proof-backed adoption, and persistent orchestration.\n\n## What Usefulness Means Under This Objective\n\nUseful means anything that materially improves:\n- revenue and conversion\n- execution speed and automation strength\n- decision quality and strategic leverage\n- cost efficiency and reliability\n- orchestration quality and agent coordination\n- capability-gap detection and self-improvement velocity\n\n## Capability Lanes That Matter Most\n\n1. Directive engine materialization - one reusable executable core that hosts can embed cleanly\n   Architecture is currently the closest lane to this objective because the current mission is to improve the Engine itself.\n2. Runtime operationalization (Runtime) - converting proven patterns into callable, bounded, measurable runtime behavior\n3. Orchestration reliability (OpenClaw) - persistent, looping, memory-backed coordination across agents and sessions\n4. Discovery as operational front door - mission-aware intake, routing, capability-gap detection, and review-cadence enforcement\n5. Behavior-preserving transformation - same capability, better implementation (speed, cost, reliability, maintainability)\n6. Evaluation quality - dimensional measurement (evaluators), not just binary gates\n7. Unified runtime host (Mission Control) - coherent command surface, less fragmented tooling\n\n## Known Capability Gaps (Open)\n\n- gap: Canonical Directive engine surface only partially materialized\n  risk: The first engine slice exists, but Directive Workspace behavior is still too distributed across host helpers, reference hosts, and Markdown-first operating assets, and the Engine/lane split is not yet deep enough to keep Discovery / Runtime / Architecture logic centered inside the Engine\n  success condition: one executable engine owns substantially more source intake, routing, adaptation/improvement, proof, and integration state with explicit host-adapter boundaries while Discovery / Runtime / Architecture operate as clear Engine lanes rather than loose top-level features\n\n## Recently Resolved Gaps\n\n- gap: Discovery as actual front door for most work - RESOLVED 2026-03-23\n  resolution: `shared/lib/discovery-front-door-coverage.ts` now measures front-door routine usage from the live corpus. Current metrics are 22 queue entries total, 14 post-primary entries, 13 native-like post-primary entries, and 100% native-like post-primary intake linkage coverage. The only post-primary entry without intake linkage is a backfill (`al-parked-cli-anything`), so Discovery-first routine usage is now confirmed for native work.\n\n- gap: OpenClaw to Discovery coordination - RESOLVED 2026-03-22\n  resolution: Root helper plus dry-run checker are active, and `dw-openclaw-discovery-submission-flow` proves a real OpenClaw-originated candidate can enter the primary Discovery queue without bypass.\n\n- gap: Architecture-to-Runtime handoff - RESOLVED 2026-03-22\n  resolution: Formal handoff record created for autoresearch bounded-run pattern. All contract fields exercised.\n\n- gap: Evaluator lane dimensional proof - RESOLVED 2026-03-22\n  resolution: Backend test boilerplate consolidation uses dimensional evaluator with numeric before/after (20.6% line reduction, 16.9% byte reduction). First non-vacuous dimensional proof.\n\n- gap: Discovery intake queue native usage - RESOLVED 2026-03-22\n  resolution: 5 native primary-mode queue entries achieved (threshold: 5+). 14 total entries (5 native, 9 backfill). Three behavior-preserving transformation candidates processed end-to-end through native queue.\n\n- gap: agent-lab legacy dependency - RESOLVED 2026-03-22\n  resolution: OpenClaw root external-tool bridge migrated to `scripts/external-tools/` with no live runtime path into `workspace/agent-lab/orchestration`. Runtime-backed adapters now read from current source packs and host-backed lanes resolve through Mission Control or OpenClaw-owned state."
  },
  "openGaps": [],
  "selectedLane": {
    "laneId": "architecture",
    "label": "Architecture",
    "hostDependence": "engine_only",
    "valuableWithoutHostRuntime": true
  },
  "candidate": {
    "candidateId": "research-engine-open-deep-research-20260406t145339z-20260406t154",
    "candidateName": "Open Deep Research",
    "recommendedLaneId": "architecture",
    "recommendedLaneLabel": "Architecture",
    "recommendedRecordShape": "split_case",
    "usefulnessLevel": "meta",
    "missionPriorityScore": 43,
    "confidence": "medium",
    "matchedGapId": null,
    "matchedGapRank": null,
    "requiresHumanReview": true,
    "rationale": [
      "No unresolved gap matched strongly enough, so the assessment relied on mission-fit and lane-signal scoring.",
      "Recommended architecture because its lane score (23) exceeded the alternatives.",
      "Primary adoption target metadata is set to architecture, which contributes directly to lane scoring instead of relying only on keyword overlap.",